{
  "schema": "diffguard.check.v1",
  "tool": {
    "name": "diffguard",
    "version": "0.2.0"
  },
  "diff": {
    "base": "origin/main",
    "head": "HEAD",
    "context_lines": 3,
    "scope": "added",
    "files_scanned": 42,
    "lines_scanned": 1337
  },
  "findings": [
    {
      "rule_id": "rust.no_eval",
      "severity": "error",
      "message": "Avoid eval - potential code injection",
      "path": "src/main.rs",
      "line": 42,
      "column": 5,
      "match_text": "eval(",
      "snippet": "    let result = eval(user_input);"
    }
  ],
  "verdict": {
    "status": "fail",
    "counts": {
      "info": 0,
      "warn": 0,
      "error": 1
    },
    "reasons": [
      "tool_error"
    ]
  }
}